{
  "schema_version": "2026-07-12",
  "name": "agentcore-gateway",
  "display_name": "AgentCore Bifrost MCP Gateway",
  "url": "http://127.0.0.1:8080/mcp",
  "host": "127.0.0.1",
  "port": 8080,
  "auth": {
    "type": "bearer",
    "header_name": "Authorization",
    "env_var_name": "BIFROST_MCP_VIRTUAL_KEY",
    "header_template": "Bearer ${env:BIFROST_MCP_VIRTUAL_KEY}"
  },
  "transport": "http/streamable",
  "timeout_seconds": 300,
  "client_render_hints": {
    "zed": {
      "enabled": false,
      "config_path": "C:\\Users\\ynotf\\AppData\\Roaming\\Zed\\settings.json",
      "syntax": "zed_settings_json",
      "supports_env_headers": false,
      "notes": [
        "Managed priority client; installed Zed 1.13.2 is verified, but AgentCore gateway enrollment and native memory lifecycle remain awaiting_operator_import until live proof exists",
        "Zed remote MCP is configured under context_servers with url and headers",
        "Zed personal instructions live at C:\\Users\\ynotf\\AppData\\Roaming\\Zed\\AGENTS.md and global skills share C:\\Users\\ynotf\\.agents\\skills",
        "Zed has no approved environment-backed header expansion or process-attested AgentCore route. AgentCore gateway enrollment is unsupported/unverified until a credential-free, native-token, or scoped-broker path is approved.",
        "A prior live Zed entry and authenticated discovery were recorded on 2026-08-20 using a credential-bearing configuration. That state is legacy drift, not an approved current enrollment instruction; this task does not inspect or mutate it.",
        "Never paste or persist an AgentCore virtual key in this client."
      ],
      "gateway_auth_mode": "unverified"
    },
    "eigent": {
      "enabled": false,
      "config_path": "C:\\Users\\ynotf\\.eigent\\mcp.json",
      "syntax": "eigent_mcp_json",
      "supports_env_headers": false,
      "notes": [
        "Managed priority client; installed Eigent 1.0.2 is verified, but AgentCore gateway enrollment and native memory lifecycle remain awaiting_operator_import until live proof exists",
        "Eigent persists standard mcpServers configuration at C:\\Users\\ynotf\\.eigent\\mcp.json and uses CAMEL MCPToolkit for remote URL connections",
        "Eigent native skills live at C:\\Users\\ynotf\\.eigent\\skills; skill availability does not prove always-on global-rule delivery",
        "Eigent/CAMEL has no approved environment-backed header expansion or process-attested AgentCore route. AgentCore gateway enrollment is unsupported/unverified until a credential-free, native-token, or scoped-broker path is approved.",
        "A prior live Eigent entry was recorded on 2026-08-20 using a credential-bearing configuration. That state is legacy drift, not an approved current enrollment instruction; this task does not inspect or mutate it.",
        "Never paste or persist an AgentCore virtual key in this client."
      ],
      "gateway_auth_mode": "unverified"
    },
    "cursor": {
      "enabled": true,
      "config_path": "C:\\Users\\ynotf\\.cursor\\mcp.json",
      "syntax": "cursor_mcp_json",
      "supports_env_headers": true,
      "notes": [
        "Use type http/url + headers Authorization Bearer ${env:BIFROST_MCP_VIRTUAL_KEY}"
      ]
    },
    "codex": {
      "enabled": true,
      "config_path": "C:\\Users\\ynotf\\.codex\\config.toml",
      "syntax": "codex_toml",
      "supports_env_headers": true,
      "notes": [
        "Replace [mcp_servers.*] baseline entries with a single agentcore-gateway HTTP server while preserving Codex-managed extras such as node_repl and plugin-provided MCP servers",
        "Use bearer_token_env_var = \"BIFROST_MCP_VIRTUAL_KEY\" so Codex constructs Authorization: Bearer without materializing the secret or treating an env placeholder as a static header",
        "Map the 300-second contract timeout to startup_timeout_sec = 300 and tool_timeout_sec = 300; do not emit the unsupported generic timeout_seconds field"
      ]
    },
    "claude-code": {
      "enabled": true,
      "config_path": "C:\\Users\\ynotf\\.claude.json",
      "syntax": "claude_code_json",
      "supports_env_headers": true,
      "notes": [
        "Merge into mcpServers if present; do not invent unrelated top-level keys"
      ]
    },
    "claude-desktop": {
      "enabled": false,
      "config_path": "C:\\Users\\ynotf\\AppData\\Roaming\\Claude\\claude_desktop_config.json",
      "syntax": "claude_desktop_json",
      "supports_env_headers": false,
      "notes": [
        "Claude Desktop has no approved environment-backed header expansion or process-attested AgentCore route. AgentCore gateway enrollment is unsupported/unverified until a credential-free, native-token, or scoped-broker path is approved.",
        "A prior credential-bearing Claude Desktop entry was recorded on 2026-07-16. That state is legacy drift, not an approved current enrollment instruction; this task does not inspect or mutate it.",
        "Never paste or persist an AgentCore virtual key in this client."
      ],
      "gateway_auth_mode": "unverified"
    },
    "minimax": {
      "enabled": true,
      "config_path": "C:\\Users\\ynotf\\.minimax\\mcp\\mcp.json",
      "syntax": "minimax_mcp_json",
      "supports_env_headers": false,
      "gateway_url": "http://127.0.0.1:18082/mcp",
      "gateway_auth_mode": "process_attested_proxy",
      "notes": [
        "MiniMax Code (D:\\Apps\\MiniMax Code or C:\\Users\\ynotf\\AppData\\Local\\Programs\\MiniMax Code)",
        "C:\\Users\\ynotf\\.mavis is a junction to C:\\Users\\ynotf\\.minimax (same MiniMax Code data root); not a separate Mavis application install",
        "MiniMax Agent Classic is a separate product with its own profile (minimax-classic)",
        "MiniMax Code uses the process-attested loopback builder compatibility proxy at http://127.0.0.1:18082/mcp so no virtual key is stored in its live JSON; unresolved or unapproved callers fail closed."
      ]
    },
    "minimax-classic": {
      "enabled": false,
      "config_path": "C:\\Users\\ynotf\\.minimax-agent\\AGENT.md",
      "syntax": "matrix_cloud_custom_mcp",
      "supports_env_headers": false,
      "notes": [
        "MiniMax Agent Classic App ID com.minimax.agent-classic",
        "Executable D:\\Apps\\MiniMaxAgent-Classic\\MiniMax Agent.exe with --user-data-dir=C:\\Users\\ynotf\\AppData\\Roaming\\MiniMaxAgent-Classic",
        "MiniMax Agent Classic has no approved credential-free, native-token, environment-backed, or scoped-broker AgentCore route. AgentCore gateway enrollment is unsupported/unverified until a credential-free, native-token, or scoped-broker path is approved.",
        "MiniMax Agent Classic enrollment was pending and no approved secure credential path was completed. Do not create a cloud custom-MCP entry for AgentCore until a governed secure route is approved.",
        "Never paste or persist an AgentCore virtual key in this client."
      ],
      "gateway_auth_mode": "unverified"
    },
    "antigravity": {
      "enabled": true,
      "config_path": "C:\\Users\\ynotf\\.gemini\\config\\mcp_config.json",
      "alternate_config_paths": [
        "C:\\Users\\ynotf\\AppData\\Roaming\\Antigravity IDE\\User\\mcp.json"
      ],
      "syntax": "antigravity_mcp_json",
      "supports_env_headers": false,
      "gateway_url": "http://127.0.0.1:18082/mcp",
      "gateway_auth_mode": "process_attested_proxy",
      "notes": [
        "Antigravity remote HTTP/SSE MCP entries use serverUrl; legacy url/httpUrl/type fields are not supported by the current Antigravity schema.",
        "Antigravity uses the Bifrost-owned process-attested loopback builder compatibility proxy at http://127.0.0.1:18082/mcp; the proxy injects the User-scope key only after exact Windows process ancestry validation, and live client files contain no credential.",
        "Do not use a public tunnel for local desktop Antigravity. The ChatGPT Settings tunnel is only for a cloud ChatGPT client that must reach a local gateway."
      ]
    },
    "zcode": {
      "enabled": true,
      "config_path": "C:\\Users\\ynotf\\.zcode\\cli\\config.json",
      "syntax": "zcode_mcp_json",
      "supports_env_headers": false,
      "gateway_url": "http://127.0.0.1:18082/mcp",
      "gateway_auth_mode": "process_attested_proxy",
      "notes": [
        "ZCode 3.10.1 is distinct from Zoo-Code and stores MCP entries under mcp.servers.",
        "Use type http, url http://127.0.0.1:18082/mcp, no headers, timeoutMs 300000, and enabled true; the loopback proxy injects the User-scope key only after exact Windows process ancestry validation.",
        "Phase 2 replaced the seven direct MCP entries with one agentcore-gateway entry while preserving ZCode native editor, PTY, ripgrep, ugrep, hooks, and non-MCP configuration."
      ]
    },
    "open-interpreter": {
      "enabled": true,
      "config_path": "C:\\Users\\ynotf\\AppData\\Roaming\\interpreter\\config.json",
      "syntax": "open_interpreter_json",
      "supports_env_headers": false,
      "gateway_url": "http://127.0.0.1:18082/mcp",
      "gateway_auth_mode": "process_attested_proxy",
      "notes": [
        "The desktop JSON uses the process-attested loopback builder compatibility proxy at http://127.0.0.1:18082/mcp; the CLI uses bearer_token_env_var with the direct gateway."
      ]
    },
    "cherry-studio": {
      "enabled": false,
      "config_path": "C:\\Users\\ynotf\\AppData\\Roaming\\CherryStudio\\Local Storage\\leveldb",
      "alternate_config_paths": [
        "C:\\Users\\ynotf\\AppData\\Roaming\\CherryStudio\\Data\\agents.db",
        "C:\\Users\\ynotf\\AppData\\Roaming\\CherryStudio\\config.json"
      ],
      "syntax": "cherry_studio_leveldb",
      "supports_env_headers": false,
      "notes": [
        "Cherry persists MCP under redux key persist:cherry-studio → mcp.servers in Local Storage LevelDB",
        "Map contract timeout_seconds=300 to Cherry server.timeout=300",